{
  "schemaVersion": 2,
  "packageId": "Orbyss.Foundation.Json.AspNetCore",
  "features": [
    {
      "identity": "Orbyss.Foundation.Json.AspNetCore",
      "featureDependencies": [],
      "runtimeDependencies": [],
      "routes": [],
      "dormant": true,
      "composeForOpenApi": true,
      "requiresContractCoverage": false
    }
  ],
  "sourceSha256": {
    "FoundationJsonEndpointExtensions.cs": "07facdfb3e27d9bf7737b61c98758d8cf8f4e9378e1602746878f5a0abe55c64",
    "FoundationJsonFeature.cs": "211f71e2ea03318be74985613babb3b093eebdb27054ee17c138809ffe747d43",
    "FoundationJsonOptions.cs": "ac87eee0ae1958fe20c17a73c27b2da0a914b87e5a80ee0368253c8e36d82559",
    "FoundationJsonRequestExceptionHandler.cs": "49c01e2ec35783ca4a86e2c96e3b18f78783326f72f3d75f285183994c8d6c0a",
    "FoundationJsonResponseExceptionHandler.cs": "c9a8fb095d17f574dd01f9e1cc25c6e425b1e5bf796a077427e582ade85dbe44",
    "FoundationJsonServiceCollectionExtensions.cs": "18cf107b976cfe79e4e03cfa7407092f5b65946c458904204989ec3ac837f6ae",
    "IJsonContractMetadata.cs": "3f298dbdc166f07191b84ed717d5740f4c2ccbe23dbfc184eec764f6549846e6",
    "IJsonProfileResult.cs": "d6842a0e6efc65588ba23640b9fb96922b3dd7fa1b0fe34f5dcad4b87f4dd197",
    "IJsonRequestReader.cs": "556f48fe694968b8ddd306bcc1ddc407c057e96287390703586f172c93c61309",
    "IJsonResponseFactory.cs": "8af0ff5ac8fedab9fa4d7400f9ba816a21fefad03c94cec72ab31c801775caa6",
    "JsonAdmissionPipeReader.cs": "6871febf985e8b2a74637e8cae4cfd87eff5a3c584afde82a66a91cb481915d3",
    "JsonAdmissionPipeWriter.cs": "efbe91d6b132253a6f49a8288b5b3f1a2c15cc50a36e1b41406eec2ae8130c50",
    "JsonAdmissionRequestBodyPipeFeature.cs": "50a18586b234d2ef6d46cf9a9717816ba3b7bc443f79173caa23c9572ccbc9e0",
    "JsonAdmissionResponseBodyFeature.cs": "4c2e6f06372824f376e823418b9c7674669bcf86dcb84dfa9f79d29c28d493fa",
    "JsonAdmissionResult.cs": "f1ad6dadce5f93eb3c7460acfb026ed232b27da3bc571dcc8b09a080ac1eaef1",
    "JsonAdmissionState.cs": "44216a09ccfa325bcd7fedca3cdf31bea9aee83353a3b0abcd2206156340f5f1",
    "JsonAdmissionStream.cs": "cc1bc4c6c32d3084471110b32802cc52fe97ce4ac529abfe77332ace2f9857ab",
    "JsonContractDirection.cs": "abff4b897a0f0a1e64a471b87bd7d782ea87e70badea2564f13334ab55057613",
    "JsonContractFactory.cs": "dc528743d34064b9a85a56a591c49dc7b5bd8e1cdc1d2521b8d552bddda35b6a",
    "JsonContractIdentity.cs": "9daf903df1c6eb37b009ed8afd34efbfc9da512985900f349f4ace2d82226379",
    "JsonContractMetadata.cs": "8580e09d7f169a92afca78e095491b95f3aae6ba7c4b7283c38a19b410464cbf",
    "JsonContractOperationTransformer.cs": "2e0da06b2847c8e2b5e6959a27363bd05a0677d6b5414d41ab0173ff1158f0db",
    "JsonContractSchemaPlan.cs": "47b814d5b7a4de75a24de6f47f90db6cd5f412cdcb6f9c05f38dc0bbbf5d190c",
    "JsonContractSchemaTransformer.cs": "5dcebabe2dd82ee61bf7972f0646c7d2ebe03edab301b8ad4f85fe7c686615f1",
    "JsonNumericSchemaPolicy.cs": "87bc6c91dca377e485b4930075ed189b2d05dcd4084a1a12a8b9b418d227d746",
    "JsonNumericSchemaShape.cs": "43e874ed0fc5ff219696bda710f8a8ea5d74682116c359fa2e920b9a942a086e",
    "JsonNumericStringKind.cs": "7eff4eaddcb54955ad1327b219b2386b81d4465817bddd053536e431a4f494b5",
    "JsonPageOptions.cs": "c8096fc696471f9e4670a4ad115f5e25cf6e1d815a5666a8ab199497be09014d",
    "JsonProfileResult.cs": "cf770b3a3dd90d9aa909d31df7da3afc8e25f662a7ef7d1140f319e7de37764f",
    "JsonRequestReader.cs": "c76387551f72a50bb84c5bd6f5cf94e6a41e09456c3ad839e23736080a5cc351",
    "JsonResponseFactory.cs": "4dd8451ea4ce163f30f519274d837628847fdb6bb532efc2b7f83fa9b9ff4de7"
  }
}
