{
  "schemaVersion": 2,
  "packageId": "Orbyss.Foundation.Authentication",
  "features": [
    {
      "identity": "Orbyss.Foundation.Authentication",
      "featureDependencies": [],
      "runtimeDependencies": [],
      "routes": [],
      "dormant": true,
      "composeForOpenApi": false,
      "requiresContractCoverage": false
    }
  ],
  "sourceSha256": {
    "DefaultAuthenticationErrorWriter.cs": "9d4446c89d6889bb5040f875c0ba17ade1a9b4d020bc3927259f6855093b38cd",
    "FoundationAuthenticationFeature.cs": "f0f062b346b50030e9865a5e7518bdf2aadd9135a43aaf2279e732b85f955592",
    "FoundationAuthenticationProfiles.cs": "e53adf5aae400932f0274e139652553730f7a804dea0d77df915e4a0c3023563",
    "FoundationWebOptions.cs": "d5cea8dde1008f58c300b02037447322332a5582303d34ddf4ce8f01fb51fa07",
    "FoundationWebOptionsValidator.cs": "c28ed0bc9751ae2c4ad8a1eee2bc9bb01901dc858a9b6b2f818d80a1d6c54e9c",
    "IAuthenticationErrorWriter.cs": "d965483f0a1c5c817a0fc3415fc93d93e7bad83b32177750d840f143b9584b6a",
    "IFoundationAuthenticationProfile.cs": "b365e3944d9e1065953cbc32d66032d9895db65d38097f700d6dd3dd94eceedc",
    "IValidatedAccountIdentityReader.cs": "3f550b0b5f7fe7f9a333d6ab01c7a9d46a09a56d778532f89c6715ee4c42ff46",
    "PermissionClaimsTransformation.cs": "a087697b47b4d59ada7ebe1442930232867d23671ebe58eafb2cae83aaa0c837",
    "PermissionPolicyNames.cs": "95b8ea4414d683afdac32e2c795d5fc993898c8d673415761319e6d2c89d3d8e",
    "PermissionPolicyProvider.cs": "bec2eb24a75cf32795cfb6e12879c456512486f2a3e1985d5fbba650a7a0ee59",
    "ValidatedAccountIdentityReader.cs": "58a2c474b99d30963c9e040868455e7347e654d7aff0428c8a61e7bc0e00c4e8"
  }
}
