{
  "schemaVersion": 2,
  "packageId": "Orbyss.Foundation.Web.HostedPages",
  "features": [
    {
      "identity": "Orbyss.Foundation.Web.HostedPages",
      "featureDependencies": [
        "Orbyss.Foundation.WebDefaults"
      ],
      "runtimeDependencies": [],
      "routes": [],
      "dormant": true,
      "composeForOpenApi": false,
      "requiresContractCoverage": false,
      "dynamicRoutesFromConfiguration": true
    }
  ],
  "sourceSha256": {
    "AdmittedHostedPageRoute.cs": "d9c05233bd52bff929a516575be03277b2b6cb838ea968e03d985739320d4bd3",
    "AdmittedHostedRevision.cs": "f82eac4f42d8354bfc38517027dfb980f7fd2f576f260516c6d1a9a4cc7c8bb5",
    "FoundationHostedPagesFeature.cs": "9d0584062e883b919b270723f1b2003967b89a31a2774d0a109b8b33d869d053",
    "HostedAssetAdmission.cs": "bf0899130f1380befbdc0f36b30e40725a53e144889b56c7fc40bbdd9b4f0160",
    "HostedAssetDescriptor.cs": "76e2a21c960803e3c096ad34cba17d5026d0f9c863d5ee8ef1668e9a5ee7a596",
    "HostedBrandLocale.cs": "6f6618812a06b83a9f51a388160ef4161c17842f6954187725e31f2b7a1bb737",
    "HostedPageAccessMode.cs": "bb01bea7b1034d738092e86d5e5f44843777b398f894822b7301f2287833bef9",
    "HostedPageAccessOptions.cs": "3d778c08f8aa7a9da7a545c4354b25e986b593621e4d34110ed2e00abd24f7a7",
    "HostedPageAdmission.cs": "b8f5972d3e3c127179090aa52bbdd016b414a11d9911fb63797402e77c821644",
    "HostedPageCatalog.cs": "217725bc5bfd9f26f7d7afa9799de70b767959722cee0b6ef7d8c5ed0d33a2e9",
    "HostedPageManifest.cs": "7ab1bacb031f69da18e943d01bf9ae213db1e7ed5ac15f4323e5b2c20af5fa00",
    "HostedPageOptions.cs": "f6e8c81dc8e0cbe67a91a3f2fd9d2f7276efe76872506fbfad72163d6a966802",
    "HostedPageRendering.cs": "e5dc940600223f909d4c274f9018777a2b32b1e7fd61c3fd04c653516d47b759",
    "HostedPageRevision.cs": "7e49ce263999d840eaba79542d9d16117e1df546a9f2b8657062ed70c57cb6f7",
    "HostedPageRouteOptions.cs": "0919139f4dbb70366c9a54ffcacb58b8cc26f65d558434d9a506306403284853",
    "HostedViteChunk.cs": "c2abdb654125efc3fb6b15f82bc81413805e33410c2e2f78c1aa5cb46f31a844",
    "IHostedAssetSource.cs": "2ecd704b528cb3a093462fc6e1eea001f3140c5b29a1dac15211f9220a194edd",
    "LocalHostedAssetSource.cs": "e317ed0274ab74944ed700b94af890d194b3a16c6410e31ec137213a47db7847",
    "PngAdmission.cs": "6760670f76612f94355b2b68141ca2e035178a7b21fa266da613616bf3bd0dd7"
  }
}
