{
  "schemaVersion": 2,
  "packageId": "Orbyss.Foundation.WebDefaults",
  "features": [
    {
      "identity": "Orbyss.Foundation.WebDefaults",
      "featureDependencies": [],
      "runtimeDependencies": [],
      "routes": [],
      "dormant": true,
      "composeForOpenApi": false,
      "requiresContractCoverage": false
    }
  ],
  "sourceSha256": {
    "CorrelationAndSecurityHeadersMiddleware.cs": "1f53e2c0e0650b649d5296df3e3f2d31f94ea0b8b14cb25fed8d83534b800150",
    "FoundationWebDefaultsFeature.cs": "113313707f353ea3100822d5b07c8f515cbf38060462d43e034140d89b449f10",
    "FoundationWebDefaultsOptions.cs": "104cd06d7440c3c26914d7cbffb51a34084898b7bce09eb2808da81692c94450",
    "FoundationWebDefaultsOptionsValidator.cs": "9bc58c697dcc37daac0aad65353a77054e2bc618aca3cbf49768dafc3d35abc7",
    "ShellWebPaths.cs": "d13e6a714c08c41e2baf7f1aee1005fe656f4b7570483aea7a466865bc811564",
    "WebResponseContributions.cs": "bf74c8ce491821a73cbe9bfe2e646f2da1cfdca29d45fb8a4b1264cb12677ac5",
    "WebResponseMetadata.cs": "13c7f9f598a6933a9b195ec4c43cd674d9e0b0f213725515f415a58d836528e5",
    "WebResponseNonceState.cs": "9b1a6a8314ccbc1bd0e0ebc3135567de42b3d2db340fd0dfe90280f0c799ad08",
    "WebResponsePoliciesMiddleware.cs": "b18d9dcde1e41b573d68db42ab80cba41ffd91cecfee091be0a9cb18096fde41",
    "WebResponsePoliciesOptions.cs": "35fee8933ea524a2e96a54604350c2d8ae0f5f0cdfe2a6e0655792caca2ee861",
    "WebResponsePolicy.cs": "5a4c0c675898f0f739ebfd56602a8484bce35e0b5bec4e2b3fd6e63bd54141c6",
    "WebResponsePolicyCatalog.cs": "f3c780d85286b1711113358976a9b2fd73fd6e74bdd03d03418f2bed22ce00f1",
    "WebResponsePolicyNames.cs": "be952ba86d20108d42e6adde7e1d55732c39ae406e29698fc173de077f1b3fe6",
    "WebResponsePolicyOptions.cs": "8fb547cf919520ba663a3a517a8561cd1ee4ea99de979984b98bff3768a4cb5b"
  }
}
